{
  "$schema": "https://json-schema.org/draft/2020-12/schema",
  "title": "metadata.get_applicability_domain.response",
  "type": "object",
  "required": ["model", "version", "criteria", "policy"],
  "properties": {
    "model": {"type": "string"},
    "version": {"type": "string"},
    "criteria": {
      "type": "array",
      "items": {"type": "object", "additionalProperties": true}
    },
    "policy": {"type": "string"},
    "errorCode": {"type": ["string", "null"]},
    "references": {
      "type": "array",
      "items": {"type": "object", "additionalProperties": true}
    }
  },
  "additionalProperties": true
}
